{
  "specversion": "1.0",
  "id": "6YVYDHE37RN15DPKJPKYTWX5RG",
  "source": "//blume.systems/mcr/telemetry/meter/M-88213-4",
  "type": "systems.blume.telemetry.meter-read-recorded.v1",
  "subject": "asset:meter:M-88213-4",
  "time": "2026-09-07T14:00:00.412Z",
  "datacontenttype": "application/json",
  "dataschema": "https://schemas.blume.systems/telemetry/meter-read-recorded/1.0.0.json",
  "blumetenant": "mcr",
  "blumeretention": "operational",
  "blumetrace": "00-35fb3fefea25d3c4d23d01713ba3f5ed-3426c896e0de6b0c-01",
  "blumeseq": 28475,
  "data": {
    "asset_ref": {
      "class": "meter",
      "id": "M-88213-4",
      "tenant": "mcr"
    },
    "utility": "electricity",
    "register": "import",
    "reading": 148203.412,
    "unit": "kWh",
    "interval_s": 1800,
    "quality": "measured",
    "provenance": {
      "producer": "utility-telemetry/1.0.0",
      "node": "site-mcr-east-01",
      "observed_at": "2026-09-07T14:00:00.412Z",
      "method": "dlms-pull"
    }
  }
}
