{
  "specversion": "1.0",
  "id": "2YY5W4963MP4ETZEGB913KX9TS",
  "source": "//blume.systems/mcr/telemetry/gateway/GW-MCR-E-14",
  "type": "systems.blume.telemetry.pressure-sampled.v1",
  "time": "2026-09-07T14:00:10.000Z",
  "datacontenttype": "application/json",
  "dataschema": "https://schemas.blume.systems/telemetry/pressure-sampled/1.0.0.json",
  "blumetenant": "mcr",
  "blumeretention": "operational",
  "blumetrace": "00-e9470705cf824dfa4870cb17893dfe02-d70eea2e20cd660a-01",
  "blumeseq": 48809,
  "data": {
    "asset_ref": {
      "class": "gateway",
      "id": "GW-MCR-E-14",
      "tenant": "mcr"
    },
    "network": "water",
    "pressure_kpa": 341.2,
    "provenance": {
      "producer": "utility-telemetry/1.0.0",
      "node": "site-mcr-east-01",
      "observed_at": "2026-09-07T14:00:10.000Z"
    }
  }
}
