{
  "specversion": "1.0",
  "id": "0TNK8DVJEMSD0X1A5MSJNX1AH7",
  "source": "//blume.systems/mcr/identity/gateway/GW-MCR-ID-01",
  "type": "systems.blume.identity.oauth-grant-revoked.v1",
  "subject": "asset:gateway:GW-MCR-ID-01",
  "time": "2026-09-07T11:02:00.410Z",
  "datacontenttype": "application/json",
  "dataschema": "https://schemas.blume.systems/identity/oauth-grant-revoked/1.0.0.json",
  "blumetenant": "mcr",
  "blumeretention": "evidential",
  "blumetrace": "00-c86e7516ac9c1d39717079cea619d70e-2ac02399bcbd5a83-01",
  "blumeseq": 20120,
  "data": {
    "subject_ref": {
      "pid": "sub:identity:e3:S7LHKBTABGA5D5VD",
      "epoch": 3
    },
    "grant_id": "GR-3-4a1c88f0",
    "reason": "resident-initiated",
    "resident_initiated": true,
    "scopes": {
      "alg": "AES-256-GCM",
      "key_id": "dk_2RJV387CF824CTFF6FTMYS6KRX",
      "epoch": 3,
      "ct": "zhhwT3crbDfP2M48Se4WxjlruxYFnJbkMiEIpOGBp7rLspSZzWEBkuef2/dIBZan",
      "iv": "LbG8GKuTVJt3gWIN"
    },
    "revoked_at": "2026-09-07T11:02:00.000Z",
    "provenance": {
      "producer": "identity-gateway/1.0.0",
      "node": "core-mcr-id-01",
      "observed_at": "2026-09-07T11:02:00.410Z",
      "method": "consent-portal"
    }
  }
}
