{
  "specversion": "1.0",
  "id": "21Y7SH6HSDP12FC83HPF057GXN",
  "source": "//blume.systems/xmpl/identity/gateway/GW-XMPL-ID-01",
  "type": "systems.blume.identity.pseudonym-issuance-recorded.v1",
  "subject": "asset:gateway:GW-XMPL-ID-01",
  "time": "2026-07-01T00:00:00.000Z",
  "datacontenttype": "application/json",
  "dataschema": "https://schemas.blume.systems/identity/pseudonym-issuance-recorded/1.0.0.json",
  "blumetenant": "xmpl",
  "blumeretention": "audit",
  "blumetrace": "00-c3bc47e3c1556dddeb3628d1a5422083-19b4f6b20e8637fd-01",
  "blumeseq": 22071,
  "data": {
    "domain": "transit",
    "epoch": 3,
    "count": 1842,
    "reason": "epoch-rotation",
    "aggregate": {
      "aggregate_id": "psi-transit-e3-epoch-rotation",
      "window": "2026-07-01T00Z",
      "revision": 0
    },
    "provenance": {
      "producer": "identity-gateway/1.0.0",
      "node": "core-xmpl-id-01",
      "observed_at": "2026-07-01T01:05:00.220Z",
      "method": "batch-rollup"
    }
  }
}
