{
  "specversion": "1.0",
  "id": "7REE6S65530PZXAMZ96ZV8J0F6",
  "source": "//blume.systems/mcr/identity/gateway/GW-MCR-ID-01",
  "type": "systems.blume.identity.authentication-evaluated.v1",
  "subject": "asset:gateway:GW-MCR-ID-01",
  "time": "2026-09-07T08:15:30.000Z",
  "datacontenttype": "application/json",
  "dataschema": "https://schemas.blume.systems/identity/authentication-evaluated/1.0.0.json",
  "blumetenant": "mcr",
  "blumeretention": "operational",
  "blumetrace": "00-391837fa852986bd5d0a340734185617-7d0e3e1187d50e47-01",
  "blumeseq": 44739,
  "data": {
    "subject_ref": {
      "pid": "sub:identity:e3:S7LHKBTABGA5D5VD",
      "epoch": 3
    },
    "principal_kind": "natural-person",
    "outcome": "success",
    "method": "mfa-webauthn",
    "session_id": "s-6b1f0c9a77e5d421",
    "evaluated_at": "2026-09-07T08:15:30.000Z",
    "provenance": {
      "producer": "identity-gateway/1.0.0",
      "node": "core-mcr-id-01",
      "observed_at": "2026-09-07T08:15:30.140Z",
      "method": "webauthn-verify"
    }
  }
}
